{"$schema":"http://json-schema.org/draft-07/schema#","type":"object","additionalProperties":false,"required":["schemaVersion","id","source","artifact","provenance","routing","incident"],"properties":{"schemaVersion":{"const":1},"id":{"const":"rarebit-alpha.1-bootstrap-exception"},"source":{"type":"object","additionalProperties":false,"required":["repository","commit","tree","tagObject","tag"],"properties":{"repository":{"const":"https://github.com/deephbz/rarebit.git"},"commit":{"const":"03647151fbf844a33c48b37ca241422558009069"},"tree":{"const":"b54bdc83c2da65572c05c664315e0a888e43f5dd"},"tagObject":{"const":"a5d6271c5ee07d872e6f98bc645266f678d41d56"},"tag":{"const":"v0.1.0-alpha.1"}}},"artifact":{"type":"object"},"provenance":{"type":"object"},"routing":{"type":"object"},"incident":{"type":"object"}}}
